citation_key,item_type,title,year,journal,volume,issue,pages,doi,pmid,keywords,source_collection,source_query,url
Lv2024SLC7A11ROSαKGAMPKaxisregulateslive,article,SLC7A11-ROS/αKG-AMPK axis regulates liver inflammation through mitophagy and impairs liver fibrosis and NASH progression.,2024,Redox Biol,72,,103159,10.1016/j.redox.2024.103159,38642501,thesis-review; sasp-xct-mechanism,thesis-review,sasp-xct-mechanism,https://pubmed.ncbi.nlm.nih.gov/38642501/
Xu2024Themechanismsofferroptosisanditsro,article,The mechanisms of ferroptosis and its role in atherosclerosis.,2024,Biomed Pharmacother,171,,116112,10.1016/j.biopha.2023.116112,38171246,thesis-review; sasp-xct-mechanism,thesis-review,sasp-xct-mechanism,https://pubmed.ncbi.nlm.nih.gov/38171246/
Venkatasubramanian2024TOLLIPinhibitslipi,article,TOLLIP inhibits lipid accumulation and the integrated stress response in alveolar macrophages to control Mycobacterium tuberculosis infection.,2024,Nat Microbiol,9,4,949-963,10.1038/s41564-024-01641-w,38528148,thesis-review; tb-macrophage-immunity,thesis-review,tb-macrophage-immunity,https://pubmed.ncbi.nlm.nih.gov/38528148/
Arias2024Tuberculosisinotherwisehealthya,article,Tuberculosis in otherwise healthy adults with inherited TNF deficiency.,2024,Nature,633,8029,417-425,10.1038/s41586-024-07866-3,39198650,thesis-review; tb-macrophage-immunity,thesis-review,tb-macrophage-immunity,https://pubmed.ncbi.nlm.nih.gov/39198650/
Salti2024WidespreadSpersulfidationinacti,article,Widespread S-persulfidation in activated macrophages as a protective mechanism against oxidative-inflammatory stress.,2024,Redox Biol,72,,103125,10.1016/j.redox.2024.103125,38574432,thesis-review; sasp-xct-mechanism,thesis-review,sasp-xct-mechanism,https://pubmed.ncbi.nlm.nih.gov/38574432/
Grosjean2025Anisletresidentmacrophageant,article,An islet-resident macrophage antioxidant program preserves β cell physiology.,2025,Sci Immunol,10,113,eadz5181,10.1126/sciimmunol.adz5181,41237222,thesis-review; sasp-xct-mechanism,thesis-review,sasp-xct-mechanism,https://pubmed.ncbi.nlm.nih.gov/41237222/
Silva2025Bedaquilinepretomanidlinezolida,article,"Bedaquiline, pretomanid, linezolid, and moxifloxacin (BPaLM) for multidrug- or rifampin-resistant tuberculosis: a systematic review.",2025,J Bras Pneumol,50,6,e20240295,10.36416/1806-3756/e20240295,39813501,bedaquiline-safety-qtc; global-burden-guidelines; linezolid-toxicity; thesis-body; thesis-review,thesis-review,global-burden-guidelines,https://pubmed.ncbi.nlm.nih.gov/39813501/
Yadav2025Bioenergeticreprogrammingofmacr,article,Bioenergetic reprogramming of macrophages reduces drug tolerance in Mycobacterium tuberculosis.,2025,Nat Commun,16,1,9370,10.1038/s41467-025-64407-w,41130947,thesis-review; tb-macrophage-immunity,thesis-review,tb-macrophage-immunity,https://pubmed.ncbi.nlm.nih.gov/41130947/
Liao2025cGASmediatedantibacterialimmunot,article,cGAS-mediated antibacterial immunotherapy against tuberculosis by macrophage-targeted manganese dioxide nanoagonist.,2025,Acta Biomater,196,,471-486,10.1016/j.actbio.2025.03.002,40044101,thesis-review; tb-macrophage-immunity,thesis-review,tb-macrophage-immunity,https://pubmed.ncbi.nlm.nih.gov/40044101/
Qin2025Enhancedglycolysisderivedlactatep,article,Enhanced glycolysis-derived lactate promotes microglial activation in Parkinson's disease via histone lactylation.,2025,NPJ Parkinsons Dis,11,1,3,10.1038/s41531-024-00858-0,39753581,thesis-review; sasp-xct-mechanism,thesis-review,sasp-xct-mechanism,https://pubmed.ncbi.nlm.nih.gov/39753581/
Lin2025ExosomalCagAinducesmacrophagepola,article,Exosomal CagA induces macrophage polarization and ferroptosis by JAK1-2/STAT1 signaling pathway in Helicobacter pylori-associated gastritis.,2025,Free Radic Biol Med,239,,91-103,10.1016/j.freeradbiomed.2025.07.031,40706822,thesis-review; sasp-xct-mechanism,thesis-review,sasp-xct-mechanism,https://pubmed.ncbi.nlm.nih.gov/40706822/
WHO2025GlobalTB,report,Global tuberculosis report 2025,2025,,,,,,,thesis-review; guideline; global-burden,thesis-review,manual,https://www.who.int/publications/i/item/9789240116924
Tian2025Hostdirectedtherapyfortuberculos,article,Host-directed therapy for tuberculosis.,2025,Eur J Med Res,30,1,267,10.1186/s40001-025-02443-4,40211397,thesis-review; hdt-review,thesis-review,hdt-review,https://pubmed.ncbi.nlm.nih.gov/40211397/
Simwela2025Impairedfattyacidimportorcata,article,Impaired fatty acid import or catabolism in macrophages restricts intracellular growth of Mycobacterium tuberculosis.,2025,Elife,13,,,10.7554/eLife.102980,40080408,thesis-review; tb-macrophage-immunity,thesis-review,tb-macrophage-immunity,https://pubmed.ncbi.nlm.nih.gov/40080408/
KrishnaPrasad2025MacrophageTcellinteract,article,Macrophage-T cell interactions promote SLAMF1 expression for enhanced TB defense.,2025,Nat Commun,16,1,6794,10.1038/s41467-025-61826-7,40701970,thesis-review; tb-macrophage-immunity,thesis-review,tb-macrophage-immunity,https://pubmed.ncbi.nlm.nih.gov/40701970/
Singh2025Preventionoftuberculosisincynom,article,Prevention of tuberculosis in cynomolgus macaques by an attenuated Mycobacterium tuberculosis vaccine candidate.,2025,Nat Commun,16,1,1957,10.1038/s41467-025-57090-4,40000643,thesis-review; tb-macrophage-immunity,thesis-review,tb-macrophage-immunity,https://pubmed.ncbi.nlm.nih.gov/40000643/
Su2025RegulationofSLC7A11asanunconventio,article,Regulation of SLC7A11 as an unconventional checkpoint in tumorigenesis through ferroptosis.,2025,Genes Dis,12,1,101254,10.1016/j.gendis.2024.101254,39569390,thesis-review; sasp-xct-mechanism,thesis-review,sasp-xct-mechanism,https://pubmed.ncbi.nlm.nih.gov/39569390/
Graziani2025SLC7A11protectsamoeboiddisse,article,SLC7A11 protects amoeboid-disseminating cancer cells from oxidative stress.,2025,Cell Rep,44,7,115939,10.1016/j.celrep.2025.115939,40651476,thesis-review; sasp-xct-mechanism,thesis-review,sasp-xct-mechanism,https://pubmed.ncbi.nlm.nih.gov/40651476/
WHO2025Module4Guideline,report,WHO consolidated guidelines on tuberculosis: module 4: treatment and care,2025,,,,,,,drug-resistant-tb; guideline; thesis-body; thesis-review,thesis-review,manual,https://www.who.int/publications/i/item/9789240107243
WHO2025Module4Handbook,report,WHO operational handbook on tuberculosis: module 4: treatment and care,2025,,,,,,,guideline; operational-handbook; thesis-body; thesis-review,thesis-review,manual,https://iris.who.int/bitstream/handle/10665/381095/9789240108141-eng.pdf
